{
  "slug": "c0396",
  "sku": "C0396",
  "title": "Graduated round diamond necklace, 18K gold",
  "subtitle": "A graduated diamond line requires every transition to be invisible — the eye should read a single increase in size and weight from the first stone to the last, not a sequence of visible steps. Each round brilliant was selected so the step from one stone to the next reads as continuation rather than increment. The engineering exists in service of the optical result.",
  "category": "necklaces",
  "collection": null,
  "status": "live",
  "refCode": "C0396",
  "stone": {
    "shape": "Round brilliant",
    "carats": "TBD",
    "origin": "A graduated diamond line requires every transition to be invisible — the eye should read a single increase in size and weight from the first stone to the last, not a sequence of visible steps. Each round brilliant was selected so the step from one stone to the next reads as continuation rather than increment. The engineering exists in service of the optical result."
  },
  "metal": "18K gold A graduated diamond line requires every transition to",
  "description": "A graduated diamond line requires every transition to be invisible — the eye should read a single increase in size and weight from the first stone to the last, not a sequence of visible steps. Each round brilliant was selected so the step from one stone to the next reads as continuation rather than increment. The engineering exists in service of the optical result.",
  "heroVideo": "https://res.cloudinary.com/dlg2mou53/video/upload/f_auto,q_auto/v1783562953/Jewelry%20Videos/Necklaces/c0396-hd.mp4",
  "heroImage": "https://res.cloudinary.com/dlg2mou53/video/upload/so_2.0,f_jpg,w_1200,c_fit/v1783562953/Jewelry%20Videos/Necklaces/c0396-hd.jpg",
  "images": [
    "https://res.cloudinary.com/dlg2mou53/video/upload/f_auto,q_auto/v1783562953/Jewelry%20Videos/Necklaces/c0396-hd.mp4"
  ],
  "inquirySubject": "C0396",
  "prettyUrl": "/jewelry/necklaces/c0396"
}