{
  "slug": "c0346",
  "sku": "C0346",
  "title": "C0346",
  "subtitle": "Description coming soon.",
  "category": "pendants",
  "collection": null,
  "status": "live",
  "refCode": "C0346",
  "stone": {
    "shape": "Round brilliant",
    "carats": "TBD",
    "origin": "Description coming soon."
  },
  "metal": "18K white gold",
  "description": "Description coming soon.",
  "heroVideo": "https://res.cloudinary.com/dlg2mou53/video/upload/f_auto,q_auto/f_auto,q_auto/Jewelry%20Videos/Pendants/c0346-hd.mp4",
  "heroImage": "https://res.cloudinary.com/dlg2mou53/video/upload/so_2.0,f_jpg,w_1200,c_fit/f_auto,q_auto/Jewelry%20Videos/Pendants/c0346-hd.jpg",
  "images": [
    "https://res.cloudinary.com/dlg2mou53/video/upload/f_auto,q_auto/f_auto,q_auto/Jewelry%20Videos/Pendants/c0346-hd.mp4"
  ],
  "inquirySubject": "C0346",
  "prettyUrl": "/jewelry/pendants/c0346"
}