{
  "slug": "c0682",
  "sku": "C0682",
  "title": "Six Asschers",
  "subtitle": "Six step-cut squares in a line, each opening onto its own depth.",
  "category": "pendants",
  "collection": null,
  "status": "live",
  "refCode": "C0682",
  "stone": {
    "shape": "Asscher",
    "carats": "TBD",
    "origin": "The Asscher cut is not about fire — it is about depth. Step facets draw the eye downward through concentric squares, creating a hall-of-mirrors effect that no brilliant cut can produce. Six of them set together in sequence compound that effect: each stone's depth connects to the next, and the visual field runs through all six simultaneously. The pendant was built to hold six Asschers in a line without interruption."
  },
  "metal": "18K gold The Asscher cut is not about fire — it is about depth",
  "description": "The Asscher is not a cut about fire — it is a cut about depth. Its step facets draw the eye downward through concentric squares, a hall-of-mirrors effect no brilliant can produce. Set six in a row, that effect compounds: each stone's depth connects to the next, and the eye travels through all six at once. The pendant was built to hold them in an uninterrupted line, corner to corner, so the sequence reads as one long descent of light in eighteen-karat gold.",
  "heroVideo": "https://res.cloudinary.com/dlg2mou53/video/upload/f_auto,q_auto/Jewelry%20Videos/Pendants/C0682_HD_vqcgaj.mp4",
  "heroImage": "https://res.cloudinary.com/dlg2mou53/video/upload/so_2.0,f_jpg,w_1200,c_fit/Jewelry%20Videos/Pendants/C0682_HD_vqcgaj.jpg",
  "images": [
    "https://res.cloudinary.com/dlg2mou53/video/upload/f_auto,q_auto/Jewelry%20Videos/Pendants/C0682_HD_vqcgaj.mp4"
  ],
  "inquirySubject": "C0682",
  "prettyUrl": "/jewelry/pendants/c0682"
}
