{
  "slug": "c0826",
  "sku": "C0826",
  "title": "Blush",
  "subtitle": "Blush color in a diamond is one of the rarest natural phenomena in fine jewelry — a trace of nitrogen arranged just so, sustained through millions of years of pressure. The radiant cut holds that color more completely than almost any other form, concentrating warmth into a single focal point. The starburst frame of white diamonds around the perimeter was designed to amplify the blush at center by contrast, not compete with it.",
  "category": "pendants",
  "collection": null,
  "status": "live",
  "refCode": "C0826",
  "stone": {
    "shape": "Radiant",
    "carats": "TBD",
    "origin": "Blush color in a diamond is one of the rarest natural phenomena in fine jewelry — a trace of nitrogen arranged just so, sustained through millions of years of pressure. The radiant cut holds that color more completely than almost any other form, concentrating warmth into a single focal point. The starburst frame of white diamonds around the perimeter was designed to amplify the blush at center by contrast, not compete with it."
  },
  "metal": "rose gold Blush color in a diamond is one of the rarest nat",
  "description": "Blush color in a diamond is one of the rarest natural phenomena in fine jewelry — a trace of nitrogen arranged just so, sustained through millions of years of pressure. The radiant cut holds that color more completely than almost any other form, concentrating warmth into a single focal point. The starburst frame of white diamonds around the perimeter was designed to amplify the blush at center by contrast, not compete with it.",
  "heroVideo": "https://res.cloudinary.com/dlg2mou53/video/upload/f_auto,q_auto/Jewelry%20Videos/Pendants/C0826_HD_ifianq.mp4",
  "heroImage": "https://res.cloudinary.com/dlg2mou53/video/upload/so_2.0,f_jpg,w_1200,c_fit/Jewelry%20Videos/Pendants/C0826_HD_ifianq.jpg",
  "images": [
    "https://res.cloudinary.com/dlg2mou53/video/upload/f_auto,q_auto/Jewelry%20Videos/Pendants/C0826_HD_ifianq.mp4"
  ],
  "inquirySubject": "C0826",
  "prettyUrl": "/jewelry/pendants/c0826"
}
