{
  "slug": "fancy-deep-brownish-yellow-cushion",
  "sku": "1C36",
  "title": "Fancy Deep Brownish Yellow Cushion",
  "subtitle": "5.38 ct GIA-graded fancy colour, 6.63 ct total",
  "category": "rings",
  "collection": null,
  "status": "live",
  "refCode": "1C36",
  "stone": {
    "shape": "Cushion (centre) + Half-moon (sides)",
    "carats": "6.63 CTW",
    "color": "Fancy Deep Brownish Yellow",
    "clarity": "SI1",
    "origin": "GIA-graded. Centre: 5.38 ct, 11.35 x 9.74 x 6.32 mm. Flanked by two half-moon side diamonds (1.25 ct TW)."
  },
  "metal": "18K gold or platinum",
  "editorial": "Fancy Deep Brownish Yellow is one of the rarest colour grades the GIA records — a hue this saturated appears in fewer than one in ten thousand diamonds. The centre stone weighs 5.38 carats, cushion-cut, 11.35 × 9.74 mm face-up, flanked by two matched half-moon side diamonds. Total weight 6.63 carats. Set in 18K gold or platinum, made to specification in Los Angeles.",
  "description": "5.38-carat Fancy Deep Brownish Yellow cushion-cut diamond ring by Bez Ambar. GIA-graded fancy colour, SI1 clarity, 11.35 x 9.74 x 6.32 mm, flanked by two half-moon side diamonds (1.25 ct TW). 6.63 ct total. 18K gold or platinum. Ref 1C36.",
  "heroVideo": "https://res.cloudinary.com/dlg2mou53/video/upload/f_auto,q_auto/v1783121539/Jewelry%20Videos/Rings/c0752-2026.mp4",
  "heroImage": "https://res.cloudinary.com/dlg2mou53/video/upload/so_2.0,f_jpg,w_1200,c_fit/v1783121539/Jewelry%20Videos/Rings/c0752-2026.jpg",
  "images": [
    "https://res.cloudinary.com/dlg2mou53/video/upload/f_auto,q_auto/v1783121539/Jewelry%20Videos/Rings/c0752-2026.mp4",
    "https://res.cloudinary.com/dlg2mou53/image/upload/v1784337062/C0752_Fancy_Deep_Brownish_Yellow_Cushion_copy_mbzjug.avif"
  ],
  "inquirySubject": "Fancy Deep Brownish Yellow Cushion ref. 1C36",
  "prettyUrl": "/jewelry/rings/fancy-deep-brownish-yellow-cushion"
}