{
  "slug": "c0305",
  "sku": "C0305",
  "title": "Yellow Cushion",
  "subtitle": "A wide face of Fancy Yellow, framed so nothing interrupts the colour.",
  "category": "rings",
  "collection": null,
  "status": "live",
  "refCode": "C0305",
  "stone": {
    "shape": "Cushion",
    "carats": "TBD",
    "color": "Fancy Yellow",
    "origin": "A Fancy Yellow cushion at this size presents its color across a wide face. The three-stone format was chosen so nothing interrupts that presentation: two Cadillac-cut white diamonds flank the center, clean geometric frames that direct attention inward rather than competing outward. One stone center, two decisions about how to hold it."
  },
  "metal": "18K yellow gold",
  "description": "A Fancy Yellow cushion of this size presents its colour across a broad, even face, and the three-stone form was chosen so that nothing interrupts that presentation. Two Cadillac-cut white diamonds flank the centre — clean geometric frames that direct the eye inward rather than competing outward. The whole design comes down to one stone at the centre and two quiet decisions about how to hold it. Set in eighteen-karat yellow gold, it exists to let the colour speak.",
  "heroVideo": "https://res.cloudinary.com/dlg2mou53/video/upload/f_auto,q_auto/v1783465063/Jewelry%20Videos/Rings/c0305-hd.mp4",
  "heroImage": "https://res.cloudinary.com/dlg2mou53/video/upload/so_2.0,f_jpg,w_1200,c_fit/v1783465063/Jewelry%20Videos/Rings/c0305-hd.jpg",
  "images": [
    "https://res.cloudinary.com/dlg2mou53/video/upload/f_auto,q_auto/v1783465063/Jewelry%20Videos/Rings/c0305-hd.mp4"
  ],
  "inquirySubject": "C0305",
  "prettyUrl": "/jewelry/rings/c0305"
}
