{
  "slug": "emerald-cut-stretch-bracelet",
  "sku": "5FLX40ECNS",
  "title": "Emerald Cut Stretch Bracelet",
  "subtitle": "Eighty emerald cuts, matched and set edge to edge, moving on the Flex.",
  "category": "bracelets",
  "collection": null,
  "status": "live",
  "refCode": "C0834",
  "stone": {
    "shape": "Emerald cut",
    "carats": 31.29,
    "color": "G-H",
    "clarity": "VS",
    "origin": "Natural. 80 matched emerald-cut diamonds, 0.375 ct each, set edge-to-edge."
  },
  "metal": "18K white gold or platinum",
  "description": "Eighty matched emerald-cut diamonds, 0.375 ct each, G-H colour and VS clarity, set edge to edge on the patented Bez Ambar Flex. 31.29 carats in all, made in Los Angeles in 18K gold or platinum. Ref 5FLX40ECNS. Price on request.",
  "heroVideo": "https://res.cloudinary.com/dlg2mou53/video/upload/f_auto,q_auto/Jewelry%20Videos/Bracelets/8k_REdo_C0834_clrwn4.mp4",
  "heroImage": "https://res.cloudinary.com/dlg2mou53/video/upload/so_2.0,f_jpg,w_1200,c_fit/v1782855871/Jewelry%20Videos/Bracelets/emerald-cut-flex-bracelet-c0834-2026.jpg",
  "images": [
    "https://res.cloudinary.com/dlg2mou53/video/upload/f_auto,q_auto/Jewelry%20Videos/Bracelets/8k_REdo_C0834_clrwn4.mp4"
  ],
  "inquirySubject": "Emerald Cut Stretch Bracelet ref. 5FLX40ECNS",
  "prettyUrl": "/jewelry/bracelets/emerald-cut-stretch-bracelet"
}
