{
  "slug": "heart-ruby",
  "sku": "BA-HR-001",
  "title": "The Heart Ruby",
  "subtitle": "Rubies set invisibly into a heart, ringed once in white diamond.",
  "category": "pendants",
  "collection": "signature",
  "status": "live",
  "refCode": "BA-HR-001",
  "stone": {
    "shape": "Heart cluster",
    "carats": 3.15,
    "color": "Natural ruby (invisibly set) + white diamonds",
    "clarity": "GIA-certified diamonds",
    "origin": "Natural rubies with brilliant-cut white diamond halo"
  },
  "metal": "18K white gold",
  "description": "Natural rubies are set invisibly into a heart-shaped cluster — no prongs, no visible metal between the stones — so the red reads as a single continuous surface rather than a group of set stones. A brilliant-cut white diamond halo rings the heart once, its cool light sharpening the edge of the form and lifting the warmth of the rubies by contrast. The invisible setting is the hardest way to build a heart and the only way to make it read this cleanly. Carried in eighteen-karat white gold.",
  "heroVideo": "https://res.cloudinary.com/dlg2mou53/video/upload/f_auto,q_auto/Jewelry%20Videos/Pendants/B5062_wtindy.mp4",
  "heroImage": "https://res.cloudinary.com/dlg2mou53/image/upload/f_auto,q_auto/v1774034036/Jewelry%20Images/Pendants/rubydiamondheart-1200_n3luta.jpg",
  "images": [
    "https://res.cloudinary.com/dlg2mou53/video/upload/f_auto,q_auto/Jewelry%20Videos/Pendants/B5062_wtindy.mp4",
    "https://res.cloudinary.com/dlg2mou53/image/upload/f_auto,q_auto:best,w_1200/v1774059296/Jewelry%20Images/Pendants/4hrt-heart-ruby-3_iwzfhk.jpg",
    "https://res.cloudinary.com/dlg2mou53/image/upload/f_auto,q_auto:best,w_1200/v1774059285/Jewelry%20Images/Pendants/heart-pendant-4HRT4_ayb1hi.jpg",
    "https://res.cloudinary.com/dlg2mou53/image/upload/f_auto,q_auto:best,w_1200/v1774086282/Jewelry%20Images/Pendants/4hrt-heart-ruby-6_tnizfe.jpg",
    "https://res.cloudinary.com/dlg2mou53/image/upload/f_auto,q_auto:best,w_1200/v1774087696/Jewelry%20Images/Pendants/4hrt-heart-ruby-5_smol2l.jpg"
  ],
  "inquirySubject": "The Heart Ruby — Ref BA-HR-001",
  "prettyUrl": "/jewelry/pendants/heart-ruby"
}
