{
  "slug": "r09059",
  "sku": "R09059",
  "title": "Fancy Yellow radiant diamond earrings, platinum and yellow gold",
  "subtitle": "The radiant cut concentrates saturation. Its cropped corners and facet pattern hold Fancy Yellow color deeper and more fully than most other forms — the warmth reads at once rather than building. The baguette halo was designed to amplify that reading: white baguettes at the perimeter create a clean frame of contrast so the yellow at center presents its full saturation without interruption.",
  "category": "earrings",
  "collection": null,
  "status": "live",
  "refCode": "R09059",
  "stone": {
    "shape": "Radiant",
    "carats": "TBD",
    "color": "Fancy Yellow",
    "origin": "The radiant cut concentrates saturation. Its cropped corners and facet pattern hold Fancy Yellow color deeper and more fully than most other forms — the warmth reads at once rather than building. The baguette halo was designed to amplify that reading: white baguettes at the perimeter create a clean frame of contrast so the yellow at center presents its full saturation without interruption."
  },
  "metal": "platinum and yellow gold The radiant cut concentrates saturation",
  "description": "The radiant cut concentrates saturation. Its cropped corners and facet pattern hold Fancy Yellow color deeper and more fully than most other forms — the warmth reads at once rather than building. The baguette halo was designed to amplify that reading: white baguettes at the perimeter create a clean frame of contrast so the yellow at center presents its full saturation without interruption.",
  "heroVideo": "https://res.cloudinary.com/dlg2mou53/video/upload/f_auto,q_auto/f_auto,q_auto/Jewelry%20Videos/Earrings/R09059_4k_final_diylja.mp4",
  "heroImage": "https://res.cloudinary.com/dlg2mou53/video/upload/so_2.0,f_jpg,w_1200,c_fit/f_auto,q_auto/Jewelry%20Videos/Earrings/R09059_4k_final_diylja.jpg",
  "images": [
    "https://res.cloudinary.com/dlg2mou53/video/upload/f_auto,q_auto/f_auto,q_auto/Jewelry%20Videos/Earrings/R09059_4k_final_diylja.mp4"
  ],
  "inquirySubject": "R09059",
  "prettyUrl": "/jewelry/earrings/r09059"
}