{
  "slug": "elysian-band-30",
  "sku": "2ELS-30",
  "title": "Elysian Band — 0.30 ct stones",
  "subtitle": "The Elysian Cut™ set full circle — an elongated light that never closes.",
  "category": "wedding-bands",
  "collection": "signature",
  "status": "live",
  "refCode": "2ELS-30",
  "stone": {
    "shape": "Elysian Cut™",
    "carats": 6.6,
    "color": "G-H",
    "clarity": "VVS",
    "origin": "Natural. Full eternity. Bez Ambar proprietary elongated cut."
  },
  "metal": "18K white gold",
  "description": "The Elysian Band in Bez Ambar's proprietary Elysian Cut™ — an elongated form that falls between an oval and a baguette, designed for a different kind of light. Full eternity. 0.30 ct stones, approximately 6.6 ct total weight. VVS clarity, G-H color. 18-karat white gold. Also available as a halfway band (2ELS-30H). Ref 2ELS-30.",
  "heroVideo": null,
  "heroImage": "https://res.cloudinary.com/dlg2mou53/image/upload/f_auto,q_auto,w_1200/v1778182500/Jewelry%20Images/Bands/2ELS-25_hero_slbeeo.jpg",
  "images": [
    "https://res.cloudinary.com/dlg2mou53/image/upload/f_auto,q_auto,w_1200/v1778182500/Jewelry%20Images/Bands/2ELS-25_hero_slbeeo.jpg"
  ],
  "inquirySubject": "Elysian Band — Ref 2ELS-30 (full eternity, approx. 6.6 ct)",
  "prettyUrl": "/jewelry/wedding-bands/elysian-band-30"
}
