{
  "slug": "3hoop30rb",
  "sku": "3HOOP30RB",
  "title": "The Triple Hoop",
  "subtitle": "The collet is the oldest setting form in fine jewellery — a ring of metal that holds the stone precisely without obscuring it. The Triple Hoop sets 18 diamonds in collets across three continuous arcs: each stone held singly, each entered from every direction, three rows of light that move as one piece on the ear. The collet here is not historical reference; it is the right setting for what these diamonds are asked to do.",
  "category": "earrings",
  "collection": null,
  "status": "live",
  "refCode": "3HOOP30RB",
  "stone": {
    "shape": "Round brilliant",
    "carats": "TBD",
    "origin": "The collet is the oldest setting form in fine jewellery — a ring of metal that holds the stone precisely without obscuring it. The Triple Hoop sets 18 diamonds in collets across three continuous arcs: each stone held singly, each entered from every direction, three rows of light that move as one piece on the ear. The collet here is not historical reference; it is the right setting for what these diamonds are asked to do."
  },
  "metal": "18K gold The collet is the oldest setting form in fine jeweller",
  "description": "The collet is the oldest setting form in fine jewellery — a ring of metal that holds the stone precisely without obscuring it. The Triple Hoop sets 18 diamonds in collets across three continuous arcs: each stone held singly, each entered from every direction, three rows of light that move as one piece on the ear. The collet here is not historical reference; it is the right setting for what these diamonds are asked to do.",
  "heroVideo": "https://res.cloudinary.com/dlg2mou53/video/upload/f_auto,q_auto/v1783377196/Jewelry%20Videos/Earrings/3hoop30rb-2026.mp4",
  "heroImage": "https://res.cloudinary.com/dlg2mou53/video/upload/so_2.0,f_jpg,w_1200,c_fit/v1783377196/Jewelry%20Videos/Earrings/3hoop30rb-2026.jpg",
  "images": [
    "https://res.cloudinary.com/dlg2mou53/video/upload/f_auto,q_auto/v1783377196/Jewelry%20Videos/Earrings/3hoop30rb-2026.mp4"
  ],
  "inquirySubject": "3HOOP30RB",
  "prettyUrl": "/jewelry/earrings/3hoop30rb"
}
