{
  "slug": "customhoop",
  "sku": "C0211",
  "title": "Round diamond hoop earrings, 18K gold",
  "subtitle": "A diamond hoop presents its light as one continuous arc rather than as individual stones — the line is the design. The Custom Hoop is built to a specific diameter and stone count, each stone calibrated to the geometry of the arc so the result reads as a single unbroken surface of diamond rather than a sequence of individual mounts. Made to order in Los Angeles.",
  "category": "earrings",
  "collection": null,
  "status": "live",
  "refCode": "C0211",
  "stone": {
    "shape": "Round brilliant",
    "carats": "TBD",
    "origin": "A diamond hoop presents its light as one continuous arc rather than as individual stones — the line is the design. The Custom Hoop is built to a specific diameter and stone count, each stone calibrated to the geometry of the arc so the result reads as a single unbroken surface of diamond rather than a sequence of individual mounts. Made to order in Los Angeles."
  },
  "metal": "18K gold A diamond hoop presents its light as one continuous ar",
  "description": "A diamond hoop presents its light as one continuous arc rather than as individual stones — the line is the design. The Custom Hoop is built to a specific diameter and stone count, each stone calibrated to the geometry of the arc so the result reads as a single unbroken surface of diamond rather than a sequence of individual mounts. Made to order in Los Angeles.",
  "heroVideo": "https://res.cloudinary.com/dlg2mou53/video/upload/f_auto,q_auto/v1783378979/Jewelry%20Videos/Earrings/c0211-hd.mp4",
  "heroImage": "https://res.cloudinary.com/dlg2mou53/video/upload/so_2.0,f_jpg,w_1200,c_fit/v1783378979/Jewelry%20Videos/Earrings/c0211-hd.jpg",
  "images": [
    "https://res.cloudinary.com/dlg2mou53/video/upload/f_auto,q_auto/v1783378979/Jewelry%20Videos/Earrings/c0211-hd.mp4"
  ],
  "inquirySubject": "C0211",
  "prettyUrl": "/jewelry/earrings/customhoop"
}