{
  "slug": "pear-detachable-ashoka-earrings",
  "sku": "PEAR-ASH-001",
  "title": "Pear and Ashoka diamond drop earrings, platinum",
  "subtitle": "A pear diamond moves differently than a round — its pointed tip traces an arc with every turn of the head. The Detachable Ashoka was designed to extend that motion: the Ashoka drop hangs below the pear stud on a locking bail that secures the connection but lets the stone swing freely. The motion is the point. The drop can be removed, leaving the pear alone. Two ways to wear the same diamonds.",
  "category": "earrings",
  "collection": null,
  "status": "live",
  "refCode": "PEAR-ASH-001",
  "stone": {
    "shape": "Pear",
    "carats": "TBD",
    "origin": "A pear diamond moves differently than a round — its pointed tip traces an arc with every turn of the head. The Detachable Ashoka was designed to extend that motion: the Ashoka drop hangs below the pear stud on a locking bail that secures the connection but lets the stone swing freely. The motion is the point. The drop can be removed, leaving the pear alone. Two ways to wear the same diamonds."
  },
  "metal": "platinum A pear diamond moves differently than a round — its pointed",
  "description": "A pear diamond moves differently than a round — its pointed tip traces an arc with every turn of the head. The Detachable Ashoka was designed to extend that motion: the Ashoka drop hangs below the pear stud on a locking bail that secures the connection but lets the stone swing freely. The motion is the point. The drop can be removed, leaving the pear alone. Two ways to wear the same diamonds.",
  "heroVideo": null,
  "heroImage": "https://res.cloudinary.com/dlg2mou53/image/upload/f_auto,q_auto:best,w_1200/f_auto,q_auto/Jewelry%20Images/Earrings/pear-ashoka-model-hero.jpg",
  "images": [],
  "inquirySubject": "PEAR-ASH-001",
  "prettyUrl": "/jewelry/earrings/pear-detachable-ashoka-earrings"
}