{
  "slug": "single-row-asscher-cut",
  "sku": "5FLX33ASC",
  "title": "Single Row Asscher Cut",
  "subtitle": "Quarter-carat Asschers on the patented Bez Ambar Flex",
  "category": "bracelets",
  "collection": null,
  "status": "live",
  "refCode": "C0755",
  "stone": {
    "shape": "Asscher",
    "carats": "Quarter-carat per stone",
    "color": "G",
    "clarity": "VS",
    "origin": "Natural. Asscher diamonds set corner-to-corner in a single row. 6.5 to 8.5 inch."
  },
  "metal": "18K white gold or platinum",
  "description": "Single-row Asscher-cut diamond flex bracelet by Bez Ambar. Quarter-carat Asscher diamonds set corner-to-corner, G colour, VS clarity, on the patented Bez Ambar Flex mechanism. 18K gold or platinum, 6.5 to 8.5 in. Ref 5FLX33ASC / C0755.",
  "heroVideo": "https://res.cloudinary.com/dlg2mou53/video/upload/Jewelry%20Videos/Bracelets/C0755_8k_abvtlc.mp4",
  "heroImage": "https://res.cloudinary.com/dlg2mou53/video/upload/so_2.0,f_jpg,w_1200,c_fit/v1782855177/Jewelry%20Videos/Bracelets/asscher-cut-single-row-bracelet-c0755-2026.jpg",
  "images": [],
  "inquirySubject": "Single Row Asscher ref. 5FLX33ASC",
  "prettyUrl": "/jewelry/bracelets/single-row-asscher-cut"
}
