{
  "slug": "blue-sapphire-single-row-flex",
  "sku": "5FLX30R",
  "title": "Blue Sapphire Single Row Flex",
  "subtitle": "Round blue sapphires and G-H VS diamonds alternating",
  "category": "bracelets",
  "collection": null,
  "status": "live",
  "refCode": "C0825",
  "stone": {
    "shape": "Round",
    "carats": "Custom — made to fit",
    "color": "Blue sapphire + G-H white diamond",
    "clarity": "VS",
    "origin": "Natural. Blue sapphires and G-H VS diamonds alternating on the patented Bez Ambar Flex."
  },
  "metal": "18K white gold or platinum",
  "description": "Round blue sapphire and diamond single-row flex bracelet by Bez Ambar. Blue sapphires and G-H VS diamonds alternating on the patented Bez Ambar Flex mechanism. Made in Los Angeles. Ref 5FLX30R / C0825.",
  "heroVideo": "https://res.cloudinary.com/dlg2mou53/video/upload/f_auto,q_auto/v1782942313/Jewelry%20Videos/Bracelets/c0825-bracelet-2026-v2.mp4",
  "heroImage": "https://res.cloudinary.com/dlg2mou53/video/upload/so_2.0,f_jpg,w_1200,c_fit/v1782941822/Jewelry%20Videos/Bracelets/blue-sapphire-single-row-flex-c0825-2026.jpg",
  "images": [
    "https://res.cloudinary.com/dlg2mou53/video/upload/f_auto,q_auto/v1782942313/Jewelry%20Videos/Bracelets/c0825-bracelet-2026-v2.mp4",
    "https://res.cloudinary.com/dlg2mou53/video/upload/f_auto,q_auto/v1782941826/Jewelry%20Videos/Bracelets/blue-sapphire-single-row-flex-c0825-2026-on-hand.mp4"
  ],
  "inquirySubject": "Blue Sapphire Single Row Flex ref. 5FLX30R",
  "prettyUrl": "/jewelry/bracelets/blue-sapphire-single-row-flex"
}