{
  "slug": "meridian",
  "sku": "C0799",
  "title": "Meridian",
  "subtitle": "A yellow center ringed in white, throwing a sunburst of baguettes outward.",
  "category": "pendants",
  "collection": null,
  "status": "live",
  "refCode": "C0799",
  "stone": {
    "shape": "Round brilliant",
    "carats": "TBD",
    "origin": "This exceptional pendant centers a fancy intense yellow round brilliant diamond, set in yellow gold prongs and encircled by a close-set halo of colorless round diamonds. Radiating outward, a full ring of tapered baguettes forms a sunburst around the center."
  },
  "metal": "yellow gold prongs and encircled by a close-set halo of color",
  "description": "A Fancy Intense Yellow round brilliant at the center, ringed close in colourless diamond. Around it, a full turn of tapered baguettes opens outward like a sunburst. The frame exists to carry the yellow.",
  "heroVideo": "https://res.cloudinary.com/dlg2mou53/video/upload/f_auto,q_auto/Jewelry%20Videos/Pendants/C0799_HD-Different_Pattern_i5tyyt.mp4",
  "heroImage": "https://res.cloudinary.com/dlg2mou53/video/upload/so_2.0,f_jpg,w_1200,c_fit/Jewelry%20Videos/Pendants/C0799_HD-Different_Pattern_i5tyyt.jpg",
  "images": [
    "https://res.cloudinary.com/dlg2mou53/video/upload/f_auto,q_auto/Jewelry%20Videos/Pendants/C0799_HD-Different_Pattern_i5tyyt.mp4"
  ],
  "inquirySubject": "meridian",
  "prettyUrl": "/jewelry/pendants/meridian"
}
