{
  "slug": "double-row-asscher-flex",
  "sku": "5FLX33ASCH2",
  "title": "The Double Row Asscher",
  "subtitle": "55.89 ct — two rows on the patented Bez Ambar Flex",
  "category": "bracelets",
  "collection": null,
  "status": "live",
  "refCode": "C0754",
  "stone": {
    "shape": "Asscher",
    "carats": 55.89,
    "color": "G",
    "clarity": "VS",
    "origin": "Natural. Quarter-carat Asscher diamonds, two rows set edge-to-edge. 6.5 to 8.5 inch."
  },
  "metal": "18K white gold or platinum",
  "description": "55.89-carat double-row Asscher-cut diamond flex bracelet by Bez Ambar. Two rows of quarter-carat Asscher diamonds edge-to-edge, G colour, VS clarity, on the patented Bez Ambar Flex mechanism. 18K gold or platinum, 6.5 to 8.5 in. Ref 5FLX33ASCH2 / C0754.",
  "heroVideo": "https://res.cloudinary.com/dlg2mou53/video/upload/f_auto,q_auto/v1782958520/Jewelry%20Videos/Bracelets/c0754-hd-2026.mp4",
  "heroImage": "https://res.cloudinary.com/dlg2mou53/video/upload/so_2.0,f_jpg,w_1200,c_fit/v1782858243/Jewelry%20Videos/Bracelets/asscher-cut-double-row-bracelet-c0754-2026.jpg",
  "images": [
    "https://res.cloudinary.com/dlg2mou53/video/upload/f_auto,q_auto/v1782940766/Jewelry%20Videos/Bracelets/hand-only-c0754-2026.mp4"
  ],
  "inquirySubject": "Double Row Asscher ref. 5FLX33ASCH2",
  "prettyUrl": "/jewelry/bracelets/double-row-asscher-flex"
}
