{
  "slug": "fluid",
  "sku": "R09142",
  "title": "FLUID",
  "subtitle": "Nine oval diamonds, each precisely matched at a quarter carat, set in an unbroken circle — but unlike any eternity band that came before it, FLUID moves. The shank is engineered to flex, contouring to the finger as it bends, shifts, and lives. Where traditional bands resist the hand, FLUID yields to it. The result is a piece that doesn't just sit on the finger — it belongs there. The oval cut was chosen deliberately. Of all diamond shapes, the oval is the most naturally graceful — no hard corners, no sharp angles, only continuous curves that echo the band's own logic. Worn still, it catches light in long, sweeping flashes. Worn in motion, it becomes something else entirely. FLUID was designed for motion. That is the point.",
  "category": "wedding-bands",
  "collection": null,
  "status": "live",
  "refCode": "R09142",
  "stone": {
    "shape": "Oval",
    "carats": "0.25",
    "origin": "Nine oval diamonds, each precisely matched at a quarter carat, set in an unbroken circle — but unlike any eternity band that came before it, FLUID moves. The shank is engineered to flex, contouring to the finger as it bends, shifts, and lives. Where traditional bands resist the hand, FLUID yields to it. The result is a piece that doesn't just sit on the finger — it belongs there. The oval cut was chosen deliberately. Of all diamond shapes, the oval is the most naturally graceful — no hard corners, no sharp angles, only continuous curves that echo the band's own logic. Worn still, it catches light in long, sweeping flashes. Worn in motion, it becomes something else entirely. FLUID was designed for motion. That is the point."
  },
  "metal": "18K white gold",
  "description": "Nine oval diamonds, each precisely matched at a quarter carat, set in an unbroken circle — but unlike any eternity band that came before it, FLUID moves. The shank is engineered to flex, contouring to the finger as it bends, shifts, and lives. Where traditional bands resist the hand, FLUID yields to it. The result is a piece that doesn't just sit on the finger — it belongs there. The oval cut was chosen deliberately. Of all diamond shapes, the oval is the most naturally graceful — no hard corners, no sharp angles, only continuous curves that echo the band's own logic. Worn still, it catches light in long, sweeping flashes. Worn in motion, it becomes something else entirely. FLUID was designed for motion. That is the point.",
  "heroVideo": "https://res.cloudinary.com/dlg2mou53/video/upload/f_auto,q_auto/Jewelry%20Videos/R09142_1_ui8yah.mp4",
  "heroImage": "https://res.cloudinary.com/dlg2mou53/image/upload/f_auto,q_auto:best,w_1200/Jewelry%20Images/Bands/R09142_Band_Oval_OnHand_kzdepw.avif",
  "images": [
    "https://res.cloudinary.com/dlg2mou53/video/upload/f_auto,q_auto/Jewelry%20Videos/R09142_1_ui8yah.mp4"
  ],
  "inquirySubject": "Inquiry — FLUID (R09142)",
  "prettyUrl": "/jewelry/bands/fluid"
}