{
  "slug": "b5062",
  "sku": "B5062",
  "title": "B5062",
  "subtitle": "Description coming soon.",
  "category": "pendants",
  "collection": null,
  "status": "live",
  "refCode": "B5062",
  "stone": {
    "shape": "Round brilliant",
    "carats": "TBD",
    "origin": "Description coming soon."
  },
  "metal": "18K white gold",
  "description": "Description coming soon.",
  "heroVideo": "https://res.cloudinary.com/dlg2mou53/video/upload/f_auto,q_auto/Jewelry%20Videos/Pendants/b5062-hd.mp4",
  "heroImage": "https://res.cloudinary.com/dlg2mou53/video/upload/so_2.0,f_jpg,w_1200,c_fit/Jewelry%20Videos/Pendants/b5062-hd.jpg",
  "images": [
    "https://res.cloudinary.com/dlg2mou53/video/upload/f_auto,q_auto/Jewelry%20Videos/Pendants/b5062-hd.mp4"
  ],
  "inquirySubject": "B5062",
  "prettyUrl": "/jewelry/pendants/b5062"
}