{
  "slug": "fancy-yellow-radiant",
  "sku": "C0878",
  "title": "Fancy Yellow Radiant",
  "subtitle": "Ten carats of Fancy Yellow, cut radiant to hold the colour at its deepest.",
  "category": "rings",
  "collection": null,
  "status": "live",
  "refCode": "C0878",
  "stone": {
    "shape": "Radiant (centre) + Cadillac cut (sides)",
    "carats": 10.04,
    "color": "Fancy Yellow",
    "origin": "Centre: 10.04 ct Fancy Yellow radiant-cut diamond. Two white Cadillac-cut side stones."
  },
  "metal": "18K yellow gold prongs · Platinum surround, side settings & micro-pavé band",
  "description": "A 10.04-carat Fancy Yellow radiant in yellow gold double-claw prongs, flanked by two white Cadillac-cut diamonds and a micro-pavé diamond band. Handcrafted in Los Angeles. Ref C0878.",
  "editorial": "A 10.04-carat Fancy Yellow radiant in yellow gold double-claw prongs, flanked by two white Cadillac-cut diamonds and a micro-pavé diamond band. The Cadillac cut — trapezoidal, step-faceted, architectural — leads the eye from the shoulder of the shank up into the centre stone. The radiant holds its colour across sixty-plus facets. The Cadillacs hold their line.",
  "heroVideo": "https://res.cloudinary.com/dlg2mou53/video/upload/f_auto,q_auto/Jewelry%20Videos/Rings/C0878_zocjks.mp4",
  "heroImage": "https://res.cloudinary.com/dlg2mou53/video/upload/so_2.0,f_jpg,w_1200,c_fit/Jewelry%20Videos/Rings/C0878_zocjks.jpg",
  "images": [
    "https://res.cloudinary.com/dlg2mou53/video/upload/f_auto,q_auto/Jewelry%20Videos/Rings/C0878_zocjks.mp4"
  ],
  "inquirySubject": "Fancy Yellow Radiant ref. C0878 — Cadillac sides",
  "prettyUrl": "/jewelry/rings/fancy-yellow-radiant"
}
