{
  "slug": "calla",
  "sku": "C0728",
  "title": "The Calla",
  "subtitle": "13 ct D Flawless pear — from the Bloom Collection",
  "category": "rings",
  "collection": "bloom",
  "status": "live",
  "refCode": "C0728",
  "stone": {
    "shape": "Pear",
    "carats": 13,
    "color": "D",
    "clarity": "Flawless",
    "origin": "Natural. GIA certified. Set in platinum, oriented along the line of the finger. Marquise-cut diamond petal ring beneath the centre."
  },
  "metal": "Platinum",
  "description": "The Calla — a single 13-carat D-flawless pear diamond, set in platinum. A ring of marquise-cut diamonds opens like petals around the pavilion, passing fire upward into the pear from below. From the Bloom Collection by Bez Ambar. Ref C0728.",
  "heroVideo": "https://res.cloudinary.com/dlg2mou53/video/upload/v1780982217/C0728_4K_1_smndkz.mp4",
  "heroImage": "https://res.cloudinary.com/dlg2mou53/video/upload/v1780982217/C0728_4K_1_smndkz.jpg",
  "images": [
    "https://res.cloudinary.com/dlg2mou53/image/upload/v1780990619/Cala_Ring_Hero_iglcjd.avif"
  ],
  "inquirySubject": "The Calla ref. C0728",
  "prettyUrl": "/jewelry/rings/calla"
}
