{
  "slug": "elysian-band-50",
  "sku": "2ELS-50",
  "title": "Elysian Band — 0.50 ct stones",
  "subtitle": "Full eternity band in the Elysian Cut™, 18K white gold — approx. 9.4 ct",
  "category": "wedding-bands",
  "collection": "signature",
  "status": "live",
  "refCode": "2ELS-50",
  "stone": {
    "shape": "Elysian Cut™",
    "carats": 9.4,
    "color": "G-H",
    "clarity": "VVS",
    "origin": "Natural. Full eternity. Bez Ambar proprietary elongated cut."
  },
  "metal": "18K white gold",
  "description": "The Elysian Band in Bez Ambar's proprietary Elysian Cut™ — an elongated form that falls between an oval and a baguette, designed for a different kind of light. Full eternity. 0.50 ct stones, approximately 9.4 ct total weight. VVS clarity, G-H color. 18-karat white gold. Also available as a halfway band (2ELS-50H). Ref 2ELS-50.",
  "heroVideo": null,
  "heroImage": "https://res.cloudinary.com/dlg2mou53/image/upload/f_auto,q_auto,w_1200/v1778099929/2ELS-50_gydi1e.png",
  "images": [
    "https://res.cloudinary.com/dlg2mou53/image/upload/f_auto,q_auto,w_1200/v1778099929/2ELS-50_gydi1e.png"
  ],
  "inquirySubject": "Elysian Band — Ref 2ELS-50 (full eternity, approx. 9.4 ct)",
  "prettyUrl": "/jewelry/wedding-bands/elysian-band-50"
}
